{
  "student": "Aluno exemplo",
  "level": "a2",
  "task_part": "part6_email",
  "subscales": ["content", "organisation", "language"],
  "calibrated": true,
  "word_count": 34,
  "min_words": 25,
  "meets_word_minimum": true,
  "content": {
    "band": 4,
    "justification": "Os três pontos foram respondidos: o transporte ('We travel at museum on bus'), o que trazer ('bootle of water, some food, and 5 Euro') e o que ver. O leitor fica no geral informado, mas 'many super since' deixa o segundo ponto obscuro — daí 4, e não 5."
  },
  "organisation": {
    "band": 3,
    "justification": "Convenções de e-mail presentes ('Hello Chris!' … 'Goodbye!'). O texto se conecta com conectores básicos de alta frequência ('and'), sem outros recursos de coesão."
  },
  "language": {
    "band": 3,
    "justification": "Vocabulário básico usado de forma razoavelmente apropriada. Formas simples com algum controle, mas os erros por vezes impedem o sentido: 'we coming', 'Your must bring', 'many super since'."
  },
  "overall_band": 3,
  "togethere_band": "PASS",
  "cefr_result": "A2 achieved",
  "errors": [
    { "excerpt": "we coming", "type": "grammar", "correction": "we are coming", "explanation": "O present continuous precisa do verbo 'to be': we are coming." },
    { "excerpt": "Your must bring", "type": "grammar", "correction": "You must bring", "explanation": "'Your' é possessivo. O sujeito da frase é 'You'." },
    { "excerpt": "bootle", "type": "spelling", "correction": "bottle", "explanation": "Dois 't', um 'o': bottle." },
    { "excerpt": "many super since", "type": "vocabulary", "correction": "many amazing things", "explanation": "A frase não fica clara. Use palavras que você já domina." },
    { "excerpt": "We travel at museum on bus", "type": "grammar", "correction": "We will travel to the museum by bus", "explanation": "Meio de transporte: 'by bus'. Destino: 'to the museum'." }
  ],
  "strengths": [
    "Abertura e fecho de e-mail corretos: 'Hello Chris!' e 'Goodbye!'.",
    "Os três pontos do enunciado foram respondidos, na ordem pedida.",
    "Boa escolha de organização ao listar o que trazer com dois-pontos: 'Your must bring: bootle of water, some food, and 5 Euro'."
  ],
  "next_steps": [
    "Revise o present continuous: am/is/are + verbo com -ing.",
    "Para planos futuros, use 'we will' ou 'we are going to'.",
    "Antes de entregar, releia procurando só os verbos: cada frase tem um verbo completo?"
  ],
  "summary_pt": "O texto cumpre a tarefa: o Chris fica sabendo como vocês vão, o que ele vai ver e o que precisa levar. A organização do e-mail está boa, com saudação e despedida. O próximo passo é o verbo — 'we are coming' em vez de 'we coming' — e isso já deixa o texto bem mais claro.",
  "confidence": "high",
  "needs_teacher_review": true,
  "assessed_at": "2026-07-12T00:00:00Z",
  "engine_version": "0.1"
}
